{
  "component_id": "corsair-rm750e-750w",
  "category": "psu",
  "name": "Corsair RM750e 750W ATX 3.1",
  "manufacturer": "Corsair",
  "model": "RM750e (2025)",
  "specs": { "watts": 750, "efficiency": "Cybenetics Gold", "atx_version": "3.1", "pcie_version": "5.1", "modular": "full", "connector": "12V-2x6" },
  "compatibility": { "form_factor": "ATX", "requires_bios_update": false },
  "tracked_sku_ids": ["corsair-rm750e-750w"],
  "source_citations": [
    { "url": "https://www.corsair.com/us/en/p/psu/cp-9020262-na/rme-series-rm750e-fully-modular-low-noise-atx-power-supply-cp-9020262-na", "tier": 1, "claim": "Corsair RM750e (2025) is a 750W fully-modular ATX 3.1 PSU with a native 12V-2x6 connector", "source_kind": "manufacturer" }
  ],
  "enriched_by": "manual",
  "created_at": "2026-06-25T00:00:00Z"
}
